{
  "schemaVersion": 2,
  "planKind": "vmPower",
  "planId": "21111111-1111-4111-8111-111111111111",
  "createdAt": "2026-07-21T08:00:00Z",
  "expiresAt": "2026-07-21T08:15:00Z",
  "hostFingerprint": "aaaaaaaaaaaaaaaaaaaaaaaaaaaaaaaaaaaaaaaaaaaaaaaaaaaaaaaaaaaaaaaa",
  "vmId": "vm-123",
  "vmName": "clean-room-01",
  "ownershipId": "22222222-2222-4222-8222-222222222222",
  "ownershipRecordSha256": "bbbbbbbbbbbbbbbbbbbbbbbbbbbbbbbbbbbbbbbbbbbbbbbbbbbbbbbbbbbbbbbb",
  "vmFingerprint": "cccccccccccccccccccccccccccccccccccccccccccccccccccccccccccccccc",
  "currentState": "Off",
  "action": "start",
  "targetState": "Running",
  "preconditions": {
    "ownershipVerified": true,
    "vmStateSupported": true,
    "noTransitionInProgress": true
  }
}
